{
  "schema_version": "layered_map_visual_package.v0.1",
  "package_id": "layered_map_visual_pkg_fen_pass_v0_1",
  "worldbook_id": "stonewind_border_march",
  "node_id": "fen_pass",
  "created_at": "2026-07-15T08:10:11Z",
  "source_refs": {
    "map_runtime_package_path": "content/generated_world_media/stonewind_border_march/maps/fen_pass/map_runtime_package.v0.2.json",
    "map_style_pack_path": "content/generated_worlds/stonewind_border_march/map_style_pack.json",
    "procedural_map_render_plan_path": "content/generated_world_media/stonewind_border_march/maps/fen_pass/procedural_map_render_plan.v0.1.json"
  },
  "runtime_semantics_source": {
    "kind": "MapRuntimePackage",
    "id": "map_pkg_fen_pass_v0_2",
    "path": "content/generated_world_media/stonewind_border_march/maps/fen_pass/map_runtime_package.v0.2.json",
    "authority": "runtime_semantic_truth"
  },
  "style_source": {
    "kind": "MapStylePack",
    "id": "style_stonewind_border_march_fen_pass_v0_1",
    "path": "content/generated_worlds/stonewind_border_march/map_style_pack.json",
    "authority": "visual_style"
  },
  "render_plan_source": {
    "kind": "ProceduralMapRenderPlan",
    "id": "render_plan_fen_pass_v0_1",
    "path": "content/generated_world_media/stonewind_border_march/maps/fen_pass/procedural_map_render_plan.v0.1.json",
    "authority": "presentation_plan"
  },
  "canvas": {
    "width": 1280,
    "height": 720,
    "format": "svg"
  },
  "coordinate_projection": {
    "projection": "pseudo3d_oblique",
    "mapping": "frontend_battle_design_space",
    "width_cells": 16,
    "height_cells": 9,
    "base_tile_w": 96.0,
    "base_tile_h": 49.92,
    "base_offset_x": 472.0,
    "base_offset_y": 78.96
  },
  "usage_policy": [
    "runtime_semantics_from_map_runtime_package",
    "visual_package_is_presentation_only",
    "no_pixel_to_semantic_inference",
    "player_default_presentation_allowed",
    "local_reviewed_artifact_only",
    "no_raw_generation_payload",
    "no_external_temporary_url",
    "painted_backdrop_must_not_bake_build_slots",
    "painted_backdrop_must_not_bake_path_routes"
  ],
  "media_assets": [
    {
      "asset_id": "fen_pass_terrain_tile",
      "role": "terrain_tile",
      "media_kind": "texture_tile_png",
      "source_kind": "procedural_texture",
      "source_local_path": "",
      "url": "/assets/generated_worlds/stonewind_border_march/maps/fen_pass/textures/fen_pass.terrain_tile.png",
      "local_path": "content/generated_world_media/stonewind_border_march/maps/fen_pass/textures/fen_pass.terrain_tile.png",
      "width": 1280,
      "height": 720,
      "sha256": "33d25c3ceb2adc69c76452f6571c0801f3f4a417b3e8bd78f72f1ed17dd207fa",
      "usage": "presentation_texture_only"
    },
    {
      "asset_id": "fen_pass_terrain_detail_tile",
      "role": "terrain_detail_tile",
      "media_kind": "texture_tile_png",
      "source_kind": "procedural_texture",
      "source_local_path": "",
      "url": "/assets/generated_worlds/stonewind_border_march/maps/fen_pass/textures/fen_pass.terrain_detail_tile.png",
      "local_path": "content/generated_world_media/stonewind_border_march/maps/fen_pass/textures/fen_pass.terrain_detail_tile.png",
      "width": 256,
      "height": 256,
      "sha256": "6c7994ffdd23512fa9ed1ab6135d32eed1da9404c7af992ec288007143216e5e",
      "usage": "presentation_texture_only"
    },
    {
      "asset_id": "fen_pass_road_tile",
      "role": "road_tile",
      "media_kind": "texture_tile_png",
      "source_kind": "procedural_texture",
      "source_local_path": "",
      "url": "/assets/generated_worlds/stonewind_border_march/maps/fen_pass/textures/fen_pass.road_tile.png",
      "local_path": "content/generated_world_media/stonewind_border_march/maps/fen_pass/textures/fen_pass.road_tile.png",
      "width": 256,
      "height": 128,
      "sha256": "20d86ac97e99fc93443a6457846d749c817ee9e2bed23743310c37a8ecdf178e",
      "usage": "presentation_texture_only"
    },
    {
      "asset_id": "fen_pass_road_edge_tile",
      "role": "road_edge_tile",
      "media_kind": "texture_tile_png",
      "source_kind": "procedural_texture",
      "source_local_path": "",
      "url": "/assets/generated_worlds/stonewind_border_march/maps/fen_pass/textures/fen_pass.road_edge_tile.png",
      "local_path": "content/generated_world_media/stonewind_border_march/maps/fen_pass/textures/fen_pass.road_edge_tile.png",
      "width": 192,
      "height": 96,
      "sha256": "bbbf86faa12d34e80616377b240201476e7c9dae1fcdf5c5961941d99f1ea5f6",
      "usage": "presentation_texture_only"
    },
    {
      "asset_id": "fen_pass_road_detail_atlas",
      "role": "road_detail_atlas",
      "media_kind": "texture_atlas_png",
      "source_kind": "procedural_texture",
      "source_local_path": "",
      "url": "/assets/generated_worlds/stonewind_border_march/maps/fen_pass/textures/fen_pass.road_detail_atlas.png",
      "local_path": "content/generated_world_media/stonewind_border_march/maps/fen_pass/textures/fen_pass.road_detail_atlas.png",
      "width": 384,
      "height": 192,
      "sha256": "88af1acc99234913e595afed6f391224e0f528f8b9be2c405cd993202cb622fd",
      "usage": "presentation_texture_only"
    },
    {
      "asset_id": "fen_pass_slot_tile",
      "role": "slot_tile",
      "media_kind": "texture_tile_png",
      "source_kind": "procedural_texture",
      "source_local_path": "",
      "url": "/assets/generated_worlds/stonewind_border_march/maps/fen_pass/textures/fen_pass.slot_tile.png",
      "local_path": "content/generated_world_media/stonewind_border_march/maps/fen_pass/textures/fen_pass.slot_tile.png",
      "width": 192,
      "height": 192,
      "sha256": "02f084b86f4d5bf224f8b97055fdd48438124f2ed6f13fd727aa17ab97e6e009",
      "usage": "presentation_texture_only"
    },
    {
      "asset_id": "fen_pass_shadow_overlay_tile",
      "role": "shadow_overlay_tile",
      "media_kind": "texture_tile_png",
      "source_kind": "procedural_texture",
      "source_local_path": "",
      "url": "/assets/generated_worlds/stonewind_border_march/maps/fen_pass/textures/fen_pass.shadow_overlay_tile.png",
      "local_path": "content/generated_world_media/stonewind_border_march/maps/fen_pass/textures/fen_pass.shadow_overlay_tile.png",
      "width": 256,
      "height": 256,
      "sha256": "f58830b6ad6442126d033ad476e215c0e26f30e902d848d44d1732947beec7cc",
      "usage": "presentation_texture_only"
    },
    {
      "asset_id": "fen_pass_fog_overlay_tile",
      "role": "fog_overlay_tile",
      "media_kind": "texture_tile_png",
      "source_kind": "procedural_texture",
      "source_local_path": "",
      "url": "/assets/generated_worlds/stonewind_border_march/maps/fen_pass/textures/fen_pass.fog_overlay_tile.png",
      "local_path": "content/generated_world_media/stonewind_border_march/maps/fen_pass/textures/fen_pass.fog_overlay_tile.png",
      "width": 256,
      "height": 256,
      "sha256": "2928c2aa9124f34a1afa5235df788fe3df3274348c5bb004645a2594cfcb835b",
      "usage": "presentation_texture_only"
    },
    {
      "asset_id": "fen_pass_light_overlay_tile",
      "role": "light_overlay_tile",
      "media_kind": "texture_tile_png",
      "source_kind": "procedural_texture",
      "source_local_path": "",
      "url": "/assets/generated_worlds/stonewind_border_march/maps/fen_pass/textures/fen_pass.light_overlay_tile.png",
      "local_path": "content/generated_world_media/stonewind_border_march/maps/fen_pass/textures/fen_pass.light_overlay_tile.png",
      "width": 256,
      "height": 256,
      "sha256": "fae42db9eb9258aa20203aef4eb501c496ee0d329222f743fb802af29c8379aa",
      "usage": "presentation_texture_only"
    }
  ],
  "layers": [
    {
      "layer_id": "layer_terrain_base",
      "role": "terrain_base",
      "order": 0,
      "player_default": true,
      "source": "map_style_pack",
      "url": "/assets/generated_worlds/stonewind_border_march/maps/fen_pass/layers/fen_pass.terrain_base.svg",
      "local_path": "content/generated_world_media/stonewind_border_march/maps/fen_pass/layers/fen_pass.terrain_base.svg",
      "width": 1280,
      "height": 720,
      "sha256": "8ba0b13926ccc7fdf8cc708f05e37d0f0ea38d84330403027d54fdd20a3faed3",
      "quality": {
        "gate_status": "passed",
        "alignment_status": "passed",
        "player_visible_quality": "passed"
      }
    },
    {
      "layer_id": "layer_terrain_detail",
      "role": "terrain_detail",
      "order": 5,
      "player_default": true,
      "source": "map_style_pack",
      "url": "/assets/generated_worlds/stonewind_border_march/maps/fen_pass/layers/fen_pass.terrain_detail.svg",
      "local_path": "content/generated_world_media/stonewind_border_march/maps/fen_pass/layers/fen_pass.terrain_detail.svg",
      "width": 1280,
      "height": 720,
      "sha256": "a4859b09633452c9d801d594064562c9622b001487ffceada5814008fb5f90f4",
      "quality": {
        "gate_status": "passed",
        "alignment_status": "passed",
        "player_visible_quality": "passed"
      }
    },
    {
      "layer_id": "layer_road_shadow",
      "role": "road_shadow",
      "order": 10,
      "player_default": true,
      "source": "procedural_map_render_plan",
      "url": "/assets/generated_worlds/stonewind_border_march/maps/fen_pass/layers/fen_pass.road_shadow.svg",
      "local_path": "content/generated_world_media/stonewind_border_march/maps/fen_pass/layers/fen_pass.road_shadow.svg",
      "width": 1280,
      "height": 720,
      "sha256": "43910a07a66f3934f47419afb8288a38495cdcd63ffb8619ab282e6bf7f7c4f9",
      "quality": {
        "gate_status": "passed",
        "alignment_status": "passed",
        "player_visible_quality": "passed"
      }
    },
    {
      "layer_id": "layer_road_edge",
      "role": "road_edge",
      "order": 12,
      "player_default": true,
      "source": "procedural_map_render_plan",
      "url": "/assets/generated_worlds/stonewind_border_march/maps/fen_pass/layers/fen_pass.road_edge.svg",